"Larissa","Reclamação","Tratativa com Automação","04/12/2025","2234943001429","Postos Alpa Ltda","Pedido da Poliana para apoio com automação da Linx: Visitei ontem o Postos Alpa e a Linx não fez a instalação do conecta no PDV Fixo e nos PDVs móveis.     A única opção disponível é a transação de acúmulo de KM no PDV fixo. Anexos seguem os vídeos do PDV fixo com a tentativa que fizemos de transação de KMV via app, não concluiu e travou o caixa. Nas smart POS não tem nada instalado.     O TI do grupo Alpa abriu chamado solicitando a instalação, porém o n1 passou para o N2. Solicito por favor acionar a Linx para solucionar o mais breve possível. Posto inaugurou em julho e até hoje não recebem o KMV.","NÃO","Parceiros Conecta","E-mail","Receptivo",,"G.N. Urbano Uberlandia","CT",,,"0","0"
"Thiago","Dúvida",,"04/12/2025","61620792000191","Centro Automotivo Bap Gravatinha Ltda","Posto solicitou informações sobre atualização de dados de acesso ao portal kmv . Alterado para  rede.bap@uol.com.b conforme solicitado aproveitamos e apresentamos o oferta é sua.","SIM","Torre de Expansão","Whastapp","Receptivo","04/12/2025","G.N. Urbano Sp Oeste","Revendedor",,,"0","0"
"Thiago","Reclamação","Transação cancelada","04/12/2025","12645422000101","Brasil Leste Auto Posto Ltda","Solicitei à Ana Farandi o estorno da operação referente ao estabelecimento Brasil Leste Auto Posto Ltda (Identificador: ABA-204786969). A previsão para conclusão do processo é 09/12/2025.","NÃO","Coord. De Controladoria","Whastapp","Receptivo","04/12/2025","G.N. Urbano Sp Abc","Revendedor",,,"0","0"
"Ricardo","Dúvida","Transação cancelada","04/12/2025","9164791001646","Rede De Postos Apolo Ltda","Desfazimento, já alinhado com a Ana Paula Farandi, reembolso será acatado. ","SIM","Coord. De Controladoria","Whatsapp","Receptivo","04/12/2025","G.N. Urbano Porto Alegre","Revendedor",,,"0","0"
"Larissa","Reclamação","Erro na impressão do SLIP","05/12/2025","72374952000186","C W 332 Serv Automotores Ltda","Postos do GRUPO JOAO BASTISTA, enviaram reclamações sobre problemas na impressão do slip via PDV movel na Web Posto. Caso encaminhado a Nadine (pista) ","NÃO","KMV Pista","Whatsapp","Receptivo",,"G.N. Urbano Rio De Janeiro","Revendedor",,,"0","0"
"Thiago","Reclamação","Erro na impressão do SLIP","05/12/2025","12074139000169","Auto Posto Talisma VIla Jaguara Ltda","dentificamos duas transações no mesmo valor (R$150,00) realizadas em 13/10/2025 às 23:53 e 23:59 (códigos ABA-201942636 e ABA-201942661). Ambas foram liquidadas e não houve estorno automático. Orientação: Informei ao posto que deve ressarcir pontualmente o consumidor referente à segunda cobrança, conforme verificação no portal KMV.","SIM","Revenda","Whatsapp","Receptivo","05/12/2025","G.N. Urbano Sp Oeste","Revendedor",,,"0","0"
"Ricardo","Reclamação","Transação cancelada","05/12/2025","5815156000144","Auto Posto Portal Da Foz Ltda","Caso de desfazimento, encaminhado para Ana Paula Farandi.","NÃO","Coord. De Controladoria","Whastapp","Receptivo","05/12/2025","G.N. Urbano Londrina","Revendedor",,,"0","0"
"Larissa","Solicitação","Ajuste Lat Long","05/12/2025","55699369000126","Posto Mjs Ltda","Ajuste de lat e long a pedido do Paulo, instrutor de treinamento da Ipiranga. ","SIM","Torre de Expansão","Whatsapp","Receptivo","05/12/2025","G.N. Urbano Belo Horizonte",,,,"0","0"
"Thiago","Dúvida","OFS Desconto","05/12/2025","4785105000154","Valeça Service ","Problema com Automação – Oferta “É Sua” Posto com automação Webposto Quality relatou falha na aplicação do desconto da oferta “É Sua”. Após análise, identificamos que o problema era generalizado na automação, ocorrendo apenas no PDV móvel (no PDV fixo funcionava normalmente).","NÃO","Engenharia TI","Whatsapp","Receptivo","04/12/2025",,"Revendedor",,,"0","0"
"Thiago","Solicitação","Ajuste Lat Long","05/12/2025","30455952000160","Comercio De Combustiveis Nova Veneza Lt","Solcitação do consultor Thaina para colocar o lat long do posto pois os consumidores não conseguem favoritá-los","NÃO",,"Whastapp","Receptivo","05/12/2025","G.N. Urbano Campinas","CT",,,"0","0"
"Ricardo","Solicitação","REDE","05/12/2025","29404716000306","Auto Posto Bca Luiziana Ltda","Solicitação de religue de NIPPO. ","NÃO","Central REDE","Whastapp","Receptivo",,"G.N. Urbano Londrina","Revendedor",,,"0","0"
"Ricardo","Aquisição","KMV","05/12/2025","48227957000100","Onix Comercio De Combustiveis E Produto","Ativação (instruções iniciais de como operacionalizar e contatar a automação para instalação do Conecta). ","SIM","Torre de Expansão","Whastapp","Ativo","05/12/2025","G.N. Urbano Porto Alegre","CN",,,"0","0"
"Larissa","Reclamação","Alteração/confirmação login Portal KMV","03/12/2025","47545858000103","Posto Milani Abadia Ltda.","Ajuste de e-mail para login no portal KMV redeexpressoconveniencia@gmail.com","SIM","Torre de Expansão","Whastapp","Receptivo","03/12/2025","G.N. Urbano Uberlandia","Revendedor",,,"0","0"
"Larissa","Negociação","OFS Desconto","05/12/2025","52275228000198","Dm Derivados De Combustiveis Ltda ","Apresentação Oferta é sua desconto","NÃO","Torre de Expansão","Whatsapp","Ativo","05/12/2025","G.N. Urbano Rio De Janeiro","Revendedor",,,"0","0"
"Thiago","Reclamação",,,"37654527000140","Centro Automotivo Blue Miami Ltda","Responsável: Ana Paula Posto: Centro Automotivo Blue Miami Ltda CNPJ: 37.654.527/0001-40 Identificador da Venda: ABA-204346073 Data da Autorização: 18/11 às 21:30 Data do Estorno: 18/11 às 21:35 Valor da Transação: R$ 334,47 Valor Líquido: R$ 325,47 Meio de Pagamento: Online Status: Pendente Avaliação Observações: Venda autorizada e posteriormente estornada. Solicitar reversão ou procedimento adicional.","SIM","Coord. De Controladoria","Whastapp","Receptivo","08/12/2025","G.N. Urbano Sp Leste","Revendedor",,,"0","0"
"Thiago","Aquisição","Treinamento Produtos Digitais","05/12/2025","45132315000120","Auto Posto Master Forte Ltda","AVIVAÇÃO KMV E APLICAÇÃO DE TREINAMENTO","SIM","Torre de Expansão","Whatsapp","Ativo","05/12/2025","G.N. Urbano Sp Abc","Torre",,,"0","0"
